{"SchemaVersion":1,"ArtifactKind":"pending-sync-event","EventKind":"preview","WorktreeNamespace":"aaaaaaaaaaaaaaaaaaaaaaaaaaaaaaaaaaaaaaaaaaaaaaaaaaaaaaaaaaaaaaaa","Trigger":"fixture","ApprovedToolchainHash":"bbbbbbbbbbbbbbbbbbbbbbbbbbbbbbbbbbbbbbbbbbbbbbbbbbbbbbbbbbbbbbbb","CurrentToolchainHash":"bbbbbbbbbbbbbbbbbbbbbbbbbbbbbbbbbbbbbbbbbbbbbbbbbbbbbbbbbbbbbbbb","Commit":"cccccccccccccccccccccccccccccccccccccccc","ContextHash":"dddddddddddddddddddddddddddddddddddddddddddddddddddddddddddddddd","PreviewStatus":"non-consumable","RedactedContext":"fixture","ContentHashes":[],"ExternalDryRunCommand":"pwsh -File scripts/sync.ps1 -DryRun -PlanPath <external>"}
